{
  "id": "CTX-039",
  "type": "task",
  "summary": "Show realized and potential savings separately",
  "dependsOn": [
    "CTX-022",
    "CTX-038"
  ],
  "description": "FR-C4-08, FR-C4-09, and T10. Actual prompt tokens sit next to the counterfactual at counterfactual_limit_pct 0.70. Realized and potential are labelled estimates and are not added together.",
  "scope": [
    "The numbers match the hand calculation",
    "The page shows the estimate note and has no combined total"
  ],
  "acceptanceCriteria": "Window 10000, compact_threshold 0.60, counterfactual_limit_pct 0.70, and actual 6000 produce counterfactual_tokens 7000. realized 100 and potential 500 stay separate. The result has label estimate and no total key. The value 600 is absent. The HTML contains the estimate note and id savings-estimate, and does not contain id savings-total. FR-C4-08 FR-C4-09 T10.",
  "constraints": [
    "Do not add realized and potential together.",
    "Do not label the figures as exact.",
    "Do not add a savings-total element."
  ],
  "workerGuidance": [
    "Small local model rule: solve only the active subtask. Do not implement later CTX tasks early.",
    "Every test function for this task's subtasks must contain that slice token, for example CTX_039_1.",
    "After writing or changing a test, always call the declared pytest command before ending the turn. Do not stop with explanation text only.",
    "If the active subtask's verification already passes because earlier work implemented it correctly, run the declared command and mark the subtask done. Do not rewrite unrelated files.",
    "Keep edits inside targetArtifacts unless the subtask explicitly says otherwise.",
    "When writing tests, assert only the current subtask's scope so later subtasks still have meaningful work."
  ],
  "verification": [
    "python -m pytest tests/test_ctx_039_1_calc.py -q -k CTX_039_1",
    "python -m pytest tests/test_ctx_039_2_label.py -q -k CTX_039_2"
  ],
  "subtasks": [
    {
      "id": "CTX-039.1",
      "title": "Match the hand calculation",
      "summary": "counterfactual_tokens is 7000, realized is 100, potential is 500, and they are not summed.",
      "readLegacy": false,
      "targetArtifacts": {
        "module": "src/context_mgmt/savings.py",
        "test": "tests/test_ctx_039_1_calc.py",
        "function": "savings_view"
      },
      "scope": [
        "counterfactual_tokens 7000",
        "realized 100",
        "potential 500",
        "no total and 600 absent"
      ],
      "verification": [
        "python -m pytest tests/test_ctx_039_1_calc.py -q -k CTX_039_1"
      ],
      "instructions": [
        "Name the test function so it contains CTX_039_1.",
        "This subtask's only job: counterfactual_tokens is 7000, realized is 100, potential is 500, and they are not summed.",
        "Touch only src/context_mgmt/savings.py and tests/test_ctx_039_1_calc.py unless the test needs an existing import helper.",
        "Do not edit tests for other CTX subtasks in this attempt.",
        "label must be the string estimate.",
        "Run python -m pytest tests/test_ctx_039_1_calc.py -q -k CTX_039_1."
      ],
      "dataExamples": [
        {
          "actual_prompt_tokens": 6000,
          "context_window": 10000,
          "compact_threshold": 0.6,
          "counterfactual_limit_pct": 0.7,
          "counterfactual_tokens": 7000,
          "realized": 100,
          "potential": 500,
          "label": "estimate"
        }
      ],
      "businessRules": [
        "T10. The figures match a hand calculation and are never summed."
      ]
    },
    {
      "id": "CTX-039.2",
      "title": "Label the chart as an estimate",
      "summary": "The page contains the estimate note and savings-estimate, and not savings-total.",
      "readLegacy": false,
      "targetArtifacts": {
        "module": "static/index.html",
        "test": "tests/test_ctx_039_2_label.py"
      },
      "scope": [
        "Note text is present",
        "id savings-estimate",
        "id savings-total is absent"
      ],
      "verification": [
        "python -m pytest tests/test_ctx_039_2_label.py -q -k CTX_039_2"
      ],
      "instructions": [
        "Name the test function so it contains CTX_039_2.",
        "This subtask's only job: The page contains the estimate note and savings-estimate, and not savings-total.",
        "Touch only static/index.html and tests/test_ctx_039_2_label.py unless the test needs an existing import helper.",
        "Do not edit tests for other CTX subtasks in this attempt.",
        "Read GET /. Do not start a socket server.",
        "Run python -m pytest tests/test_ctx_039_2_label.py -q -k CTX_039_2."
      ],
      "dataExamples": [
        {
          "required": [
            "savings-estimate",
            "Estimate. Realized savings are tokens already removed. Potential savings are tokens a compaction would remove. They are not added together."
          ],
          "forbidden": [
            "savings-total"
          ]
        }
      ],
      "businessRules": [
        "FR-C4-09: every savings figure is labelled an estimate."
      ]
    }
  ],
  "implementationLogic": {
    "targetModules": [
      "src/context_mgmt/savings.py",
      "static/index.html"
    ],
    "businessRules": [
      "counterfactual_tokens = int(window * counterfactual_limit_pct)."
    ],
    "verificationCommands": [
      "python -m pytest tests/test_ctx_039_1_calc.py -q -k CTX_039_1",
      "python -m pytest tests/test_ctx_039_2_label.py -q -k CTX_039_2"
    ]
  }
}
