{
  "id": "CTX-064",
  "type": "task",
  "summary": "Probe undefined data-plane paths",
  "dependsOn": [
    "CTX-040"
  ],
  "description": "T8-2. At least the listed paths on the data plane return byte-identical 404 bodies and no framework header.",
  "scope": [
    "The path list shares one body and one status",
    "No response has a server or x-powered-by header"
  ],
  "acceptanceCriteria": "GET of /license, /license/status, /license/reload, /docs, /openapi.json, /redoc, /admin, /metrics, /stats, and /events returns status 404, equal body bytes, code not_found, and no server or x-powered-by header. T8-2.",
  "constraints": [
    "Do not return a different body for a path that exists on the management plane.",
    "Do not add a version header.",
    "Do not serve these paths from the data plane."
  ],
  "workerGuidance": [
    "Small local model rule: solve only the active subtask. Do not implement later CTX tasks early.",
    "Every test function for this task's subtasks must contain that slice token, for example CTX_064_1.",
    "After writing or changing a test, always call the declared pytest command before ending the turn. Do not stop with explanation text only.",
    "If the active subtask's verification already passes because earlier work implemented it correctly, run the declared command and mark the subtask done. Do not rewrite unrelated files.",
    "Keep edits inside targetArtifacts unless the subtask explicitly says otherwise.",
    "When writing tests, assert only the current subtask's scope so later subtasks still have meaningful work."
  ],
  "verification": [
    "python -m pytest tests/test_ctx_064_1_probe.py -q -k CTX_064_1"
  ],
  "subtasks": [
    {
      "id": "CTX-064.1",
      "title": "Compare the probe bodies",
      "summary": "The ten paths return equal 404 bodies and no server header.",
      "readLegacy": false,
      "targetArtifacts": {
        "module": "src/context_mgmt/planes.py",
        "test": "tests/test_ctx_064_1_probe.py",
        "function": "create_data_plane"
      },
      "scope": [
        "Ten paths",
        "Equal content bytes",
        "Status 404",
        "No server header"
      ],
      "verification": [
        "python -m pytest tests/test_ctx_064_1_probe.py -q -k CTX_064_1"
      ],
      "instructions": [
        "Name the test function so it contains CTX_064_1.",
        "This subtask's only job: The ten paths return equal 404 bodies and no server header.",
        "Touch only src/context_mgmt/planes.py and tests/test_ctx_064_1_probe.py unless the test needs an existing import helper.",
        "Do not edit tests for other CTX subtasks in this attempt.",
        "Use TestClient. Do not start a socket server.",
        "Run python -m pytest tests/test_ctx_064_1_probe.py -q -k CTX_064_1."
      ],
      "dataExamples": [
        {
          "paths": [
            "/license",
            "/license/status",
            "/license/reload",
            "/docs",
            "/openapi.json",
            "/redoc",
            "/admin",
            "/metrics",
            "/stats",
            "/events"
          ]
        }
      ],
      "businessRules": [
        "T8-2. Undefined data-plane paths are byte-identical."
      ]
    }
  ],
  "implementationLogic": {
    "targetModules": [
      "src/context_mgmt/planes.py"
    ],
    "businessRules": [
      "Include the management paths in the probe so their existence is not leaked."
    ],
    "verificationCommands": [
      "python -m pytest tests/test_ctx_064_1_probe.py -q -k CTX_064_1"
    ]
  }
}
