{
  "id": "GRAPH-047",
  "type": "task",
  "summary": "Tag .resource callers as user_keyword not test_case",
  "dependsOn": [
    "GRAPH-010",
    "GRAPH-031"
  ],
  "description": "nodes_from_edges currently marks every non-Python caller as test_case. A keyword in a .resource file that calls another keyword is a user_keyword, or the legend will paint it as a start node.",
  "scope": [
    "Change nodes_from_edges in src/living_graph/merge.py",
    "Caller type is library_keyword for .py, user_keyword for .resource, test_case for .robot",
    "scan_fixtures then tests/fixtures/simple_keywords.resource::Keyword One has type user_keyword"
  ],
  "acceptanceCriteria": "After nodes_from_edges / scan_fixtures, Keyword One from simple_keywords.resource is type user_keyword. Happy Path from simple_test.robot stays test_case.",
  "constraints": [
    "Strict TDD: write the failing test first and run it before implementation.",
    "Do not implement GRAPH-048.",
    "Do not add UI, watcher, or CLI code unless this task explicitly requires it.",
    "Keep fixtures tiny (2-5 meaningful lines).",
    "Do not change unresolved type.",
    "Do not change .py library_keyword behavior from GRAPH-031."
  ],
  "verification": [
    "python -m pytest tests/test_resource_caller_type.py tests/test_scan_python_node_type.py tests/test_dedupe_nodes.py -q"
  ],
  "subtasks": [
    {
      "id": "GRAPH-047.1",
      "title": "Resource callers are user_keyword",
      "summary": "Suffix .resource means caller user_keyword. .robot callers stay test_case.",
      "readLegacy": false,
      "targetArtifacts": {
        "function": "nodes_from_edges",
        "module": "src/living_graph/merge.py",
        "test": "tests/test_resource_caller_type.py"
      },
      "relatedArtifacts": [
        {
          "path": "tests/fixtures/simple_keywords.resource",
          "purpose": "Keyword One calls Keyword Two."
        },
        {
          "path": "tests/fixtures/simple_test.robot",
          "purpose": "Happy Path must stay type test_case."
        }
      ],
      "scope": [
        "Change nodes_from_edges in src/living_graph/merge.py",
        "Caller type is library_keyword for .py, user_keyword for .resource, test_case for .robot",
        "scan_fixtures then tests/fixtures/simple_keywords.resource::Keyword One has type user_keyword"
      ],
      "dataExamples": [
        "simple_keywords.resource::Keyword One type is user_keyword.",
        "simple_test.robot::Happy Path type is test_case.",
        "simple_library.py::open_session type stays library_keyword."
      ],
      "businessRules": [
        "Decide caller type from source_path suffix.",
        "Resolved .resource callees stay user_keyword.",
        "Do not break GRAPH-010 id identity {source_path}::{name}."
      ],
      "verification": [
        "python -m pytest tests/test_resource_caller_type.py tests/test_scan_python_node_type.py tests/test_dedupe_nodes.py -q"
      ],
      "instructions": [
        "Write the failing test in tests/test_resource_caller_type.py first.",
        "Run python -m pytest tests/test_resource_caller_type.py -q and confirm failure.",
        "Implement only the .resource caller type rule in nodes_from_edges.",
        "Run python -m pytest tests/test_resource_caller_type.py tests/test_scan_python_node_type.py tests/test_dedupe_nodes.py -q and stop when they pass."
      ]
    }
  ],
  "implementationLogic": {
    "targetModules": [
      "src/living_graph/merge.py"
    ],
    "businessRules": [
      "Decide caller type from source_path suffix.",
      "Resolved .resource callees stay user_keyword.",
      "Do not break GRAPH-010 id identity {source_path}::{name}."
    ],
    "verificationCommands": [
      "python -m pytest tests/test_resource_caller_type.py tests/test_scan_python_node_type.py tests/test_dedupe_nodes.py -q"
    ]
  }
}
