{
  "id": "CTX-029",
  "type": "task",
  "summary": "Serve license state from memory",
  "dependsOn": [
    "CTX-028"
  ],
  "description": "FR-C7-08. The request path reads a cached license state and does not call the loader. refresh() updates the cache. The due check uses check_interval_seconds 900.",
  "scope": [
    "read returns the cached state while the loader raises",
    "refresh replaces the cached state",
    "due is false until 900 seconds have passed"
  ],
  "acceptanceCriteria": "cached_license_state(cache) returns the stored active dict and does not call a loader that raises. refresh(loader) stores the loader result. due(0, 899, 900) is false and due(0, 900, 900) is true. FR-C7-08.",
  "constraints": [
    "Do not open a file or socket inside cached_license_state.",
    "Do not recompute the verdict on every read.",
    "Do not use a wall clock in the test."
  ],
  "workerGuidance": [
    "Small local model rule: solve only the active subtask. Do not implement later CTX tasks early.",
    "Every test function for this task's subtasks must contain that slice token, for example CTX_029_1.",
    "After writing or changing a test, always call the declared pytest command before ending the turn. Do not stop with explanation text only.",
    "If the active subtask's verification already passes because earlier work implemented it correctly, run the declared command and mark the subtask done. Do not rewrite unrelated files.",
    "Keep edits inside targetArtifacts unless the subtask explicitly says otherwise.",
    "When writing tests, assert only the current subtask's scope so later subtasks still have meaningful work."
  ],
  "verification": [
    "python -m pytest tests/test_ctx_029_1_cache.py -q -k CTX_029_1",
    "python -m pytest tests/test_ctx_029_2_interval.py -q -k CTX_029_2"
  ],
  "subtasks": [
    {
      "id": "CTX-029.1",
      "title": "Read the cache without calling the loader",
      "summary": "cached_license_state returns active while the loader raises RuntimeError.",
      "readLegacy": false,
      "targetArtifacts": {
        "module": "src/context_mgmt/license.py",
        "test": "tests/test_ctx_029_1_cache.py",
        "function": "cached_license_state"
      },
      "scope": [
        "Cached state is active",
        "Loader raises",
        "Result state is active"
      ],
      "verification": [
        "python -m pytest tests/test_ctx_029_1_cache.py -q -k CTX_029_1"
      ],
      "instructions": [
        "Name the test function so it contains CTX_029_1.",
        "This subtask's only job: cached_license_state returns active while the loader raises RuntimeError.",
        "Touch only src/context_mgmt/license.py and tests/test_ctx_029_1_cache.py unless the test needs an existing import helper.",
        "Do not edit tests for other CTX subtasks in this attempt.",
        "Pass the loader only to refresh, not to the read function.",
        "Run python -m pytest tests/test_ctx_029_1_cache.py -q -k CTX_029_1."
      ],
      "dataExamples": [
        {
          "input": {
            "cache": {
              "state": "active"
            }
          },
          "output": {
            "state": "active"
          }
        }
      ],
      "businessRules": [
        "FR-C7-08: the request path does no license I/O."
      ]
    },
    {
      "id": "CTX-029.2",
      "title": "Refresh on the interval",
      "summary": "refresh stores the new state, and due is true at 900 seconds and false at 899.",
      "readLegacy": false,
      "targetArtifacts": {
        "module": "src/context_mgmt/license.py",
        "test": "tests/test_ctx_029_2_interval.py",
        "function": "refresh_license"
      },
      "scope": [
        "refresh replaces active with expired",
        "due(0, 899, 900) is false",
        "due(0, 900, 900) is true"
      ],
      "verification": [
        "python -m pytest tests/test_ctx_029_2_interval.py -q -k CTX_029_2"
      ],
      "instructions": [
        "Name the test function so it contains CTX_029_2.",
        "This subtask's only job: refresh stores the new state, and due is true at 900 seconds and false at 899.",
        "Touch only src/context_mgmt/license.py and tests/test_ctx_029_2_interval.py unless the test needs an existing import helper.",
        "Do not edit tests for other CTX subtasks in this attempt.",
        "Default interval is 900 seconds.",
        "Run python -m pytest tests/test_ctx_029_2_interval.py -q -k CTX_029_2."
      ],
      "dataExamples": [
        {
          "before": "active",
          "after": "expired",
          "interval_seconds": 900
        }
      ],
      "businessRules": [
        "Startup and the interval are the moments that call the loader."
      ]
    }
  ],
  "implementationLogic": {
    "targetModules": [
      "src/context_mgmt/license.py"
    ],
    "businessRules": [
      "cached_license_state is the name later components must call."
    ],
    "verificationCommands": [
      "python -m pytest tests/test_ctx_029_1_cache.py -q -k CTX_029_1",
      "python -m pytest tests/test_ctx_029_2_interval.py -q -k CTX_029_2"
    ]
  }
}
